{"envelope_version":1,"message_id":"01890f47-7cc2-7a1b-8d5d-7f6ebc9c1202","message_kind":"event","message_name":"edtech.transport.cell-probe.observed","message_schema_version":1,"emitted_at":"2023-07-01T00:00:00.000002Z","source":{"kind":"cell","cell_id":"cell-001"},"scope":{"kind":"tenant","cell_id":"cell-001","tenant_id":"01890f47-7cc2-7a1b-8d5d-7f6ebc9c1501","assignment_epoch":"18446744073709551615"},"target":null,"correlation_id":"01890f47-7cc2-7a1b-8d5d-7f6ebc9c1301","causation_id":"01890f47-7cc2-7a1b-8d5d-7f6ebc9c1201","payload":{"operation_id":"01890f47-7cc2-7a1b-8d5d-7f6ebc9c1401","accepted":true}}
