{"envelope_version":1,"message_id":"01890f47-7cc2-7a1b-8d5d-7f6ebc9c1204","message_kind":"event","message_name":"edtech.transport.platform-probe.observed","message_schema_version":1,"emitted_at":"2023-07-01T00:00:00.000004Z","source":{"kind":"platform"},"scope":{"kind":"tenant","cell_id":"cell-001","tenant_id":"01890f47-7cc2-7a1b-8d5d-7f6ebc9c1502","assignment_epoch":"9223372036854775808"},"target":null,"correlation_id":"01890f47-7cc2-7a1b-8d5d-7f6ebc9c1302","causation_id":"01890f47-7cc2-7a1b-8d5d-7f6ebc9c1203","payload":{"operation_id":"01890f47-7cc2-7a1b-8d5d-7f6ebc9c1402","accepted":true}}
