{"envelope_version":1,"message_id":"01890f47-7cc2-7a1b-8d5d-7f6ebc9c1201","message_kind":"command","message_name":"edtech.transport.cell-probe.requested","message_schema_version":1,"emitted_at":"2023-07-01T00:00:00.000001Z","source":{"kind":"platform"},"scope":{"kind":"tenant","cell_id":"cell-001","tenant_id":"01890f47-7cc2-7a1b-8d5d-7f6ebc9c1501","assignment_epoch":"18446744073709551615"},"target":{"kind":"cell","cell_id":"cell-001"},"correlation_id":"01890f47-7cc2-7a1b-8d5d-7f6ebc9c1301","causation_id":null,"payload":{"operation_id":"01890f47-7cc2-7a1b-8d5d-7f6ebc9c1401","probe_value":"checkpoint-04-cell-probe"}}
